Variable Type,Variable,Information,Variable Schema,Categories,Reference,Default Value,Default LHS Scalar Minimum at Final Time Period,Default LHS Scalar Maximum at Final Time Period,Simplex Group,Emissions Total by Gas Component,Notes
Input,Elasticity of Megatonne-Kilometer Demand to GDP,,``elasticity_trde_mtkm_to_gdp_$CAT-TRANSPORTATION-DEMAND$``,``freight``,,0,1,1,,0,
Input,Elasticity of Passenger-Kilometer Demand per Capita to GDP per Capita,,``elasticity_trde_pkm_to_gdppc_$CAT-TRANSPORTATION-DEMAND$``,``private_and_public``|``regional``,,0,1,1,,0,
Input,Initial Megatonne-Kilometer Demand,Total transportation demand forfreight transport in MT-km. This value represents the total mass of freight moved (in MT) multiplied by the number of km is was moved.  ,"``deminit_trde_$CAT-TRANSPORTATION-DEMAND$_$UNIT-MASS$_$UNIT-LENGTH$`` (``$UNIT-MASS$ = mt``, ``$UNIT-LENGTH$ = km``)",``freight``,,0,1,1,,0,
Input,Initial per Capita Passenger-Kilometer Demand,Per capita demand (in passenger-kilometers) for private and public/reigonal travel,``deminit_trde_$CAT-TRANSPORTATION-DEMAND$_per_capita_passenger_$UNIT-LENGTH$`` (``$UNIT-LENGTH$ = km``),``private_and_public``|``regional``,,0,1,1,,0,
Input,Transportation Demand Scalar,"Scale demand for transportation up or down--for example, increases in teleworking might reduce demand for private and public transportation, but it could possibly increase demands for regional travel and/or freight.",``demscalar_trde_$CAT-TRANSPORTATION-DEMAND$``,all,,0,1,1,,0,
Output,Megatonne-Kilometer Demand,,"``dem_trde_$CAT-TRANSPORTATION-DEMAND$_$UNIT-MASS$_$UNIT-LENGTH$`` (``$UNIT-MASS$ = mt``, ``$UNIT-LENGTH$ = km``)",``freight``,,0,1,1,,0,
Output,Passenger-Kilometer Demand,,``dem_trde_$CAT-TRANSPORTATION-DEMAND$_passenger_$UNIT-LENGTH$`` (``$UNIT-LENGTH$ = km``),``private_and_public``|``regional``,,0,1,1,,0,
